id,subject,scene,quality,relevance,verified,script,objects,descriptions,actions,length,,,,,,,,,,,,,,,,,,,,,,,,
WMBOO,ZAWX,Pantry,7,7,Yes,"A person opens the door to the pantry and begins stocking it with some groceries. The person picks up a roll of paper towels from the floor and places it on the shelf, then leaves.",cabinet,door,floor,food,groceries,shelf,towel,"A person sitting on the floor opens a cabinet, puts some items on the shelf, closes the cabinet, gets up and walks away.",c081 7.20 30.30,c130 7.00 30.50,c125 0.00 33.80,c008 0.20 7.50,c130 4.30 19.80,c006 26.50 31.80,c154 28.30 34.00,c113 0.20 7.30,c114 4.20 30.70,c062 4.20 29.70,33.29,,,,,,,,,
3C36H,XXN8,Basement (A room below the ground floor),4,7,Yes,"Person is sitting on chair doing homework, Another person opening bag and starts sneezing.",bag,chair,paper,"A person is holding a bag, while another person sits in a chair and begins writing.",c059 0.60 34.00,c115 0.00 34.00,c145 0.50 30.70,c020 0.00 34.00,c021 3.10 10.00,c151 0.00 5.10,c154 27.40 32.70,32.54,,,,,,,,,,,,,,,,
ZYVTC,D0RU,Living room,,,No,"A person is sitting on a pile of clothes eating food.  The person puts the food down and opens a book to read.  The person grabs their phone, gets up and leaves.",book,clothes,food,hair,phone/camera,table,"A young person coming into the room, sitting in a chair at a desk, eating some food, and opening a book, and then getting up from the chair.",c027 17.30 38.50,c032 17.10 30.90,c063 3.90 16.70,c156 7.40 16.30,c151 1.30 7.50,c154 34.30 40.00,c061 5.00 16.70,c062 12.50 16.90,c145 17.30 31.30,c144 22.00 28.00,c011 2.10 38.10,c059 1.30 38.00,c014 17.00 33.50,c016 28.90 38.10,39.04,,,,,,
J40UT,EIO2,Bathroom,6,7,Yes,"A person in a bathroom is holding a glass. The person drinks the last of the coffee in a glass, then washes a glass in the sink. And begins tidying up the bathroom.",coffee,cup,glass,sink,{},A person is drinking a glass of coffee. A person then takes the cup and places the cup in the sink.,c106 0.00 5.50,c107 0.00 11.10,31.88,,,,,,,,,,,,,,,,,,,
9HGNV,D0RU,Entryway (A hall that is generally located at the entrance of a house),6,6,Yes,A person walking into an entryway is snuggling a pillow and blanket.,blanket,door,pillow,"A person is holding blankets and carries them through a doorway.;A person walks down a hallway and into a room, carrying and snuggling a pillow and blanket. The person walks across the room and over to a door, and then looks out the door.",c076 4.50 33.00,c078 4.20 33.00,c070 3.40 33.00,c072 3.40 33.00,c097 5.60 11.40,31.75,,,,,,,,,,,,,,,,,,
HQZ29,L4ZP,Kitchen,6,7,Yes,"A person is smiling and pouring milk on a bowl of cereal, then using a towel to wipe up spilt milk and finally putting bowl in sink in kitchen.",bowl,container,counter,dish,milk,sink,table,water,A person stands up in front of a table and pours milk into a bowl.  The person then puts a dish into the sink.,A person picks up a container and pours water into a bowl. Then they pick up a dish off of the counter and put them in the sink.,c118 16.90 24.40,c009 14.10 19.00,c119 20.10 26.30,31.5,,,,,,,,,,,,,,
LW5O6,HJJ4,Dining room,6,7,Yes,"A person is tidying up the dining room with a vacuum, then smiles as they find a pair of shoes under the table.",bag,floor,shoe,table,vacuum,A person is vacuuming They stop and pick up shoes off the floor under the table while smiling.,c053 9.60 17.00,c137 0.00 13.10,c152 7.30 17.00,c023 9.50 16.00,c127 9.60 17.00,c127 0.00 13.50,15.62,,,,,,,,,,,,,,,
PKEZI,BYF9,Bedroom,7,7,Yes,"Person A is in a bedroom eating a plate of food and reading a book.  Done eating, person A gets up and walks over to the wardrobe and begins undressing.",bed,book,clothes,food,jacket,wardrobe,A person sits on a bed and looks at a book while eating some food. The person gets off the bed and takes off their jacket.,A person is sitting on a bed while reading a book and eating some food. They then stand up and take off their jacket.,c156 5.50 27.70,c155 29.10 40.00,c135 0.00 26.90,c026 0.00 28.10,c061 5.30 27.50,c154 28.50 40.00,c025 21.00 27.50,c028 22.30 28.70,c027 0.50 7.60,c032 0.30 28.30,c030 0.00 4.30,c030 0.00 34.50,c000 28.70 40.00,c002 28.30 40.00,38.58,,,,,
ZHLLU,R1OT,Home Office / Study (A room in a house used for work),4,7,Yes,A person is sitting on the floor looking at a mirror then they begin to sneeze holding a pillow.,floor,mirror,pillow,"A person is sitting down on the floor, looks into a mirror, sneezes and hugs a pillow.",c076 0.00 26.00,c078 10.80 26.00,c125 0.00 26.00,c096 1.80 15.80,c153 7.40 12.60,24.96,,,,,,,,,,,,,,,,,,
F50DT,XXN8,Stairs,4,7,Yes,A person is watching a laptop while another person is smiling at a camera.,camera,laptop,phone,A person is playing with a laptop while another person watches a video on their phone while sitting on the stairs.,c015 0.00 33.00,c047 0.00 33.00,c152 0.00 33.00,c087 0.00 32.60,c016 0.00 32.70,c149 0.00 33.00,31.96,,,,,,,,,,,,,,,,,
H3E1E,XXN8,Home Office / Study (A room in a house used for work),6,6,Yes,"A person sits in the garage, drinking a cup of coffee while reading a book.",book,coffee,cup,dish,glass,"A person drinks coffee, then flips through a book and drinks more coffee.",c032 7.40 30.10,c106 0.00 6.10,c027 4.50 30.60,c118 0.00 7.80,c118 13.10 22.20,c028 0.00 28.00,c026 4.50 30.20,c030 4.10 30.70,33.62,,,,,,,,,,,,,
CXSYS,DXDI,Kitchen,6,7,Yes,A person sneezes into a bag while sitting in a chair. They get up and start cooking at the stove.,bag,chair,food,stove,A person sits in a chair with a bag and then sneezes. The person gets up and goes and cooks on a stove.,c020 0.00 12.90,c059 0.00 14.10,c147 13.00 24.00,c022 5.40 10.10,c154 5.60 11.00,23.38,,,,,,,,,,,,,,,,,
8HLKN,YMXV,Home Office / Study (A room in a house used for work),5,7,Yes,A person is laughing as they look at a laptop in a home office. The person is sitting a desk and has a towel draped over the person's shoulders.,chair,desk,laptop,scraf,towel,A person is shaking their head while they sit in front of their computer. They have a towel around their neck that they play with. They rock back and forth.,A person sitting at a decks in front of a lap top laughing and bouncing back and forth .The person grabs the scarf several times and keeps on laughing.,,30.96,,,,,,,,,,,,,,,,,,,
JL3VT,T7C3,Bedroom,7,7,Yes,A person runs into a bedroom and grabs a sandwich off a table. They walk out of the room.,dish,sandwich,table,A person walks over to a plate of food and picks it up and takes it from the room.,c067 5.00 20.00,c069 3.30 10.40,c120 3.30 8.60,c119 14.90 20.00,c118 4.50 17.00,19.38,,,,,,,,,,,,,,,,,,
7P0HA,DXDI,Bathroom,6,6,Yes,"One person throws a bottle of medicine in the sink, then washes up and runs out with a pillow.",hand,medicine,pillow,sink,table,"person puts a medicine bottle in the bathroom sink, takes it back and sets on counter, washes and dries hands, picks up a pillow and holds against their chest and walks away",c076 21.50 27.00,c139 7.10 18.70,c009 4.90 10.30,c078 22.50 27.00,c128 0.70 6.30,c079 20.70 25.70,25.88,,,,,,,,,,,,,,,
2XG25,QB52,Bedroom,4,5,Yes,"A person awakens in their bedroom.They look in a mirror, grab a laptop and leave.",bed,blanket,mirror,phone,pillow,"A person waking and getting out of bed, checking out their face, straightening up the cloths and picking up their phone and walking out of the room.;The person wakes, gets out of bed, checks themselves out in the mirror, grabs their phone and walks away.",c096 14.80 24.30,c146 0.00 4.90,c133 0.00 11.00,c018 22.20 29.20,c015 22.30 29.80,30.54,,,,,,,,,,,,,,,,
MD6P2,PKND,Recreation room / Man cave,6,7,Yes,"A person is standing in the rec room grasping a bottle of medicine.  The person opens the medicine and pours it into a tablespoon.  After taking the medicine, the person closes the medicine and puts it back in a box.",box,food,medicine,spoon,table,"A person opens a bottle of medicine, pours some into a spoon, closes the medicine bottle and puts it into a box.",c039 14.00 29.80,c129 0.00 8.80,c128 0.00 5.80,c041 5.00 13.40,c128 5.10 22.30,c129 13.20 28.80,c156 7.00 13.00,c040 11.60 19.10,c012 9.60 29.30,c009 14.20 19.30,31.71,,,,,,,,,,,
YYMLT,D0RU,Recreation room / Man cave,7,7,Yes,A person is laughing at doing the homework on the laptop while standing by the vacuum.,laptop,A person is using their laptop while laughing.,c051 3.50 32.00,c149 25.90 32.00,c152 15.80 20.70,31.17,,,,,,,,,,,,,,,,,,,,,,
V1PRP,4OHY,Stairs,7,3,Yes,A person is seen snuggling while sitting on a chair. They begin vacuuming the stairs while standing up.,chair,floor,vacuum,A person sat up from sitting on the stairs and walked down to pick up a vacuum and start vacuuming the stairs.,c137 20.70 30.00,c151 9.50 15.90,c154 11.30 16.30,c059 0.00 14.80,c127 19.20 30.00,29.42,,,,,,,,,,,,,,,,,,
X1R6D,KFGP,Bathroom,5,6,Yes,"A person walks into the bathroom, laughing. The person closes the door behind them, and washes their hands in the sink.",door,hand,sink,water,"A person goes into a bathroom, closes the door, and washes their hands.;a person enters the bathroom and washes their hands",c139 6.10 25.00,c006 2.20 8.90,c141 2.20 8.80,c097 0.00 5.40,23.88,,,,,,,,,,,,,,,,,,
29LL7,PKND,Living room,5,6,Yes,"One person runs through, grasps a pair of shoes and some clothes, then leaves laughing.",clothes,doorway,shoe,A laughing person runs around the room grasping shoes and clothes before standing in a doorway then entering a very dark room.,c053 2.70 33.00,c149 9.60 16.20,c152 9.70 21.40,c000 8.10 17.60,c097 20.60 28.80,c002 8.10 13.50,31.54,,,,,,,,,,,,,,,,,
0OUEP,KQI6,Bedroom,6,5,Yes,"Two persons are sitting on the bed snuggling.  One person is holding a camera and a glass of water.  The other person gets up, grabs the doorknob, and closes the door.",bed,camera,closet/cabinet,door,glass,sofa/couch,water,Two people are sitting down. One person is drinking a soda beverage and the other person gets up and closes a door.,c106 8.40 18.70,c135 0.00 25.00,c006 26.20 33.00,c154 20.90 29.60,c016 1.70 10.40,c112 27.30 32.60,c123 0.00 26.60,c152 18.60 25.50,c015 2.70 10.60,32.33,,,,,,,,,,
705RV,XXN8,Kitchen,7,7,No,A person is seen fixing a sandwich. They then start putting the sandwich on a table and begin taking some medicine.,bag,bread,cover,food,jar,medicine,sandwich,shelf,spoon,twist tie,"Person removes bread from bag, uses spoon to pretend to spread something, puts bread down, opens jar, pours something from Jar, eats it and puts jar down;A person is making a sandwich, they then take some medicine.",c067 4.30 21.20,c068 15.50 21.80,c021 1.80 9.40,c063 0.80 20.20,c129 18.10 26.90,c066 0.00 20.20,c154 0.00 30.30,c020 0.00 6.50,c023 0.00 9.50,c156 18.90 29.50,c128 17.50 30.30,30.42,,,,,
FKZTG,25TD,Hallway,6,6,Yes,A person takes a sandwich and a book from a table in the hallway. The person leaves.,bag,book,sandwich,table,"The person walks to the table and takes off a sandwich, then turns around and takes a book off the table as well.",c026 23.80 31.00,c067 12.50 22.70,c020 14.90 22.70,c150 24.20 30.00,30.42,,,,,,,,,,,,,,,,,,
HOI88,XXN8,Recreation room / Man cave,6,7,Yes,A person is snuggling with a book while another person is grasping a desk.,book,couch,pillow,sofa,table,"One person is sitting on the couch, holding a book, and rocking like they are sick or cold.  Another person comes and sits down next to the other person and lays her head down on the coffee table/desk.;person sits on the sofa and another person sits next to them and leans on a table",c009 4.20 23.30,c026 10.70 17.40,c151 21.20 29.10,c123 11.70 21.60,c010 21.20 34.60,c011 2.60 31.90,c078 0.00 35.00,c154 27.90 34.40,34.12,,,,,,,,,,,,,
SBMQX,5LWB,Entryway (A hall that is generally located at the entrance of a house),6,7,Yes,A person is drinking a glass of juice while standing in the hall near the entrance to their house. A stranger is watching this scene through the side window.,cup,dish,glass,window,"A person is drinking from a glass while standing. A second person is standing outside of the window, staring in.",c106 0.00 31.00,c107 0.00 31.00,c118 0.00 8.40,30.29,,,,,,,,,,,,,,,,,,,
CYLQ0,ZAWX,Pantry,6,7,Yes,A person opens the door to a cabinet in their pantry. They grab a can of food and close the cabinet.,cabinet,doorway,food,spices,"A person is walking into the kitchen, they then take some food from the cabinet and close the cabinet.;A person walks into the kitchen and opens the cabinet. They remove some spices.",c061 7.90 15.30,c063 15.10 23.10,c112 12.10 21.10,c113 2.10 10.40,c097 10.20 29.00,30.5,,,,,,,,,,,,,,,,,
AEZDA,UO0Z,Hallway,7,6,Yes,A person is eating from a bag of groceries in a hallway then starts playing with a vacuum.,bag,desk,food,table,vacuum,a person eats out of a bag then sets it on the desk and turns on a vacuum,A person is eating some food from a bag.  Then they start using a vacuum to clean up.,c020 0.00 12.90,c137 9.90 18.10,c156 0.00 9.50,c061 0.00 12.70,c024 7.30 13.00,c137 10.30 36.00,c009 7.30 13.00,c022 5.50 13.60,35,,,,,,,,,,,,
2BUDH,KQI6,Living room,6,6,Yes,One person was grasping for some food. And then they started drinking in the light.,chair,cup,dish,glass,table,water,"A person walks in the room carrying some dishes. They place the dishes on a table and sit down in the chair.  Then they pick up a glass, pour water in it and take a drink.;A person is walking into the living room with something in her hand. They sit down and take a drink of water from a glass",c108 20.70 25.50,c151 11.70 17.50,c119 8.00 14.10,c059 13.70 31.00,c118 4.00 12.00,c107 20.10 31.00,c110 4.40 18.10,c011 13.20 31.00,c106 21.50 31.00,c119 3.80 16.60,c009 10.80 16.70,29.83,,,,,,,,,
2ZFG4,KFGP,Other,6,6,Yes,A person in the hallway is washing a window near a chair. They are smiling.,door,rag,towel,window,A person is walking to a door and washing the window in the door with a towel.,A person is standing up and cleaning small window on a door.,c091 1.40 25.00,23.67,,,,,,,,,,,,,,,,,,,,
W2TL1,LTAC,Home Office / Study (A room in a house used for work),7,7,Yes,A person is sitting at a desk and throwing food at a television.,desk,food,television,A person sitting on a table throws things at a television.,c064 0.00 32.00,c061 0.00 32.00,30.92,,,,,,,,,,,,,,,,,,,,,
G7LU9,KFGP,Hallway,6,6,Yes,"Person is in room. Person smells cooking, Person opens doorknob. Person hears laughing. Person closes door, sad.",door,"A person is in a hall way.  That same person goes and opens the door, looks out and then closes it.",c141 13.50 23.70,c006 10.00 17.20,c008 5.00 13.60,c097 11.20 15.80,23.96,,,,,,,,,,,,,,,,,,,,,
WEYV3,4OHY,Home Office / Study (A room in a house used for work),5,7,Yes,A person is seen eating a sandwich at their desk. They begin holding their phone to make a call.,desk,food,laptop,phone,sandwich,snack,table,A person is sitting at a table playing on a laptop and eating a snack. Then he picks up a phone and talks on it.,{},A person is eating while playing on their laptop and talking on their phone.,c014 0.00 30.00,c016 14.50 24.00,c065 0.00 5.50,c156 0.00 3.90,c052 0.00 12.50,c011 0.00 30.00,c067 0.00 30.00,c061 0.00 30.00,c019 18.80 30.00,c015 14.10 30.00,29.25,,,,,,,
BIK4X,WG9D,Bedroom,2,1,No,A person is lying on the sofa eating food.  They pick up a cup of coffee.,chair,cup,food,sandwich,A person is sitting in a chair eating a sandwich they pick up a drink,A person is sitting on a chair and eating.,c110 2.40 7.00,c061 0.00 6.20,c156 0.00 6.30,c059 0.00 7.00,c065 0.00 6.10,5.75,,,,,,,,,,,,,,,,
E7ESG,D0RU,Living room,6,7,No,"A person is lying down on a sofa, fast asleep. They awaken and look at the time on their phone. They then rush over to the desk, open a book and prepare to continue their homework.",bed,book,chair,desk,phone,table,"A person is laying on a bed. The person picks up a phone, looks at it, then immediately sits up. The person stands up, walks to a table and sits down to look at a book.",c032 26.20 31.90,c016 14.10 20.30,c018 13.30 18.50,c154 17.00 23.90,c027 24.30 32.00,c015 11.10 28.60,c017 21.80 30.50,c146 11.90 20.40,c151 23.50 30.80,c134 0.00 23.60,c014 25.90 32.00,c059 25.40 32.00,c011 25.70 32.00,c145 27.80 32.00,31.42,,,,,,
KZK6W,HR43,Kitchen,7,7,Yes,"A person is cooking food on the stove. The person pours some oil into the pan, then drinks from a glass of water.",cup,food,glass,stove,water,"A person stands at a stove cooking some food.  They grab a bottle of oil, pour some into a pot and then put it back down. They take a glass of water from the counter and drink it.",c106 0.00 6.30,c106 5.30 16.90,c109 8.70 22.20,c110 14.70 30.40,c147 14.70 36.00,c147 8.70 23.80,35.46,,,,,,,,,,,,,,,
A4SR3,QB52,Recreation room / Man cave,6,7,Yes,A person is eating while watching television. The person begins laughing and places their food on the table.,bowl,chair,dish,food,spoon,table,A person is eating with a bowl and spoon sitting in a chair.  The person enjoys this food and smiles.  The person then puts away the bowl and spoon.,A person is eating some food from a bowl while sitting.  The person puts the food aside and smiles.,c061 0.00 21.20,c062 17.10 23.80,c156 0.00 16.40,c149 12.30 31.00,c059 0.00 31.00,c152 13.30 31.00,c118 0.00 23.30,30.04,,,,,,,,,,,,
CD11G,ZSRZ,Kitchen,7,7,Yes,"A person is cooking food on a stove, then opening a refrigerator and eating in a kitchen.",dish,food,knob,pot,refrigerator,stove,"A person is cooking on the stove.  They then open the refrigerator and take a bite of food.;A person turns a knob and stirs a pot on a stove. The person then opens the refrigerator door and takes food out. The person takes a bite of the food, and closes the refrigerator.",c156 9.80 16.20,c143 5.00 11.90,c143 4.20 18.90,c147 0.00 7.70,c142 13.70 19.00,c118 1.80 9.00,17.92,,,,,,,,,,,,,,
0MFAM,ZAWX,Entryway (A hall that is generally located at the entrance of a house),5,7,Yes,A person is standing in the doorway.  Then a person is grasping a broom.,broom,doorway,A person leans against a door. The person picks up a broom and twirls it in their hands.,c098 22.20 32.00,c100 22.90 28.30,31.25,,,,,,,,,,,,,,,,,,,,,,
OVH9Y,UTMU,Bedroom,6,7,Yes,"A person is lying in bed while watching television. After a few seconds the person gets back to working on cleaning the room. The person walks over to a vacuum turns it on, vacuuming the floor for a bit.",bed,floor,phone,television,vacuum,"A person is climbing into bed and holding a phone. The person then tosses the phone aside, gets out of bed, and starts vacuuming.;A person is laying down on a bet holding a remove and watching television, they then get up and begin vacuuming the floor.",c134 0.00 19.80,c137 18.60 33.00,c154 20.50 33.00,c132 0.20 19.40,c127 17.90 33.00,32.08,,,,,,,,,,,,,,,,
3W5GB,ZAWX,Closet / Walk-in closet / Spear closet,6,6,Yes,Person A is in a closet putting away some towels.  Person A throws one that is unpleasant looking and camera and a picture leaving the closet.,clothes,shelf,towel,wardrobe,"A person looks through clothing on a shelf. They pick up a small towel, examine it, then throw it off to the side.",c033 14.30 25.50,c035 13.50 18.60,c036 20.70 25.80,c152 26.00 32.00,c002 14.10 19.20,c003 20.70 25.70,c082 0.00 18.90,30.71,,,,,,,,,,,,,,,
EASCD,D0RU,Living room,7,7,Yes,The person pours out the rest of their soda into a glass and takes a drink.  Then they pick up their dirty dishes off the coffee table and carry them to the sink.,chair,cup,dish,glass,sink,soda,sofa/couch,table,"A person is sitting on the bed brushing his hair with his hands. He pours a glass of soda and then takes a drink and sets the glass back down. He rearranges some dishes on the table and then grabs them, gets up, and takes them to the sink.",c106 11.50 24.40,c107 10.40 24.00,c107 6.30 35.40,c123 0.00 35.00,c009 17.30 30.20,c012 19.80 32.30,c119 17.10 25.00,c120 12.50 25.00,c109 12.50 25.00,c011 0.00 36.40,c108 12.50 25.00,c118 13.10 24.40,c154 31.60 37.50,c110 3.20 8.80,c059 0.00 35.60,41.46,,,
O1LOW,D0RU,Entryway (A hall that is generally located at the entrance of a house),6,7,Yes,A person walks through a door into a hall and sees a book and other items on the floor. They pick up the book and tidy the area.,book,door,floor,something,table,A person is picking books and other things off floor and another person also does the same.  They then put objects on a table in an entryway.,c008 1.60 9.30,c028 14.70 22.80,c127 7.80 25.10,c009 23.10 28.10,c026 8.00 27.00,c116 15.00 27.10,c117 8.30 27.60,c115 8.30 27.60,c030 9.40 17.60,31.17,,,,,,,,,,,,
3BVG1,KQI6,Hallway,5,7,No,A person puts a broom inside a hallway closet and closes the door. Another person is sitting in the hallway.,broom,closet/cabinet,door,sofa/couch,"A WOMAN IS HOLDING THE BROOM AND SWINGS IT IN THE AIR AND STARTS TO BROOM THE WALLS AND AIR, WHILE A MAN SITS ON A COUCH",c098 0.00 20.60,c123 11.70 29.80,c097 4.00 12.00,c099 16.10 21.70,c141 18.40 24.10,c112 20.90 26.60,30.67,,,,,,,,,,,,,,,,
P5SWU,KQI6,Living room,7,7,Yes,One person is holding the pillow while the other is fixing the television.,couch,pillow,sofa,television,"Two people are sitting on a couch. One holds a pillow and one walks over to work on the television.;Person ,while sitting down, picks up a pillow and cuddles it.  Person fixes television.",c076 0.80 18.90,c078 0.00 21.60,c079 0.30 6.00,c123 0.00 18.90,c132 19.60 28.10,30.58,,,,,,,,,,,,,,,,,
7B1CR,T7C3,Entryway (A hall that is generally located at the entrance of a house),7,7,Yes,A person sneezing at their phone then drinking out of a glass.,cup,glass,phone,A person holding a glass and a phone sneezes twice on the phone.,c106 16.70 29.00,c107 0.00 29.00,c015 0.00 23.70,c153 10.30 17.00,c016 0.00 19.30,c017 11.00 19.10,27.79,,,,,,,,,,,,,,,,,
2JKR8,PKND,Kitchen,6,6,Yes,A person is using a broom. After they are finished they leave it in the sink and begin taking some food to bring into another room.,broom,dish,doorway,floor,food,sink,A person sweeps the floor while another places food on a table.,c102 0.10 21.80,c062 22.00 33.00,c097 27.80 33.00,c118 23.30 33.00,c063 22.00 33.00,c099 5.70 24.90,c127 5.20 18.40,32.17,,,,,,,,,,,,,
WJFGC,KFGP,Stairs,5,7,Yes,A person is carrying a box with a laptop on top down the stairs. They stop and stand as they take the laptop and open it. They sit on the stairs and start to work on it.,box,floor,laptop,"A person walks down stairs carrying a box, then they open the box, sit down, remove a laptop and begin to play on it.",c050 10.40 17.40,c040 0.00 22.80,c041 9.80 15.60,c151 16.10 21.20,c125 16.30 37.00,35.79,,,,,,,,,,,,,,,,,,
ON2VH,YA10,Kitchen,7,7,Yes,"One person cooks at the stove, then takes a book and a camera and leaves the room.",book,food,phone/camera,stove,A person is stirring a pot on the stove then they walk over to the counter and pick up a book and walk out.,c030 18.10 23.70,c147 0.00 21.00,c015 21.40 30.40,c026 18.50 31.00,30.21,,,,,,,,,,,,,,,,,,
FN457,9PLL,Bedroom,6,6,Yes,A person is smiling into a mirror while grasping a picture.,mirror,picture,A person is looking at themselves in the mirror and then looks at a picture.,c084 17.70 33.00,c096 0.00 18.20,c152 0.00 7.00,c088 17.90 33.00,32,,,,,,,,,,,,,,,,,,,,
WOD0G,ZAWX,Entryway (A hall that is generally located at the entrance of a house),7,7,Yes,"A person runs into the entryway, carrying a towel and a book. The person throws the towel onto the table.",book,clothes,doorway,table,towel,"A person is walking in the hallway holding a book and with a towel in thier shoulder, they then throw they towel on a table.",c026 0.00 32.00,c009 10.80 20.20,c033 0.00 20.00,c034 10.80 20.20,c036 10.80 20.20,c097 0.00 13.90,c003 14.50 19.90,30.79,,,,,,,,,,,,,,
J4GX8,UTMU,Laundry room,4,5,Yes,"The person can sneeze while holding a glass, The person can take their medicine while drinking a glass of water.",cup,glass,medicine,water,"A person is standing in the laundry room. They sneeze, then appear to take some medicine by swallowing it.",c129 16.60 22.20,c106 18.80 27.30,c153 0.00 5.80,c107 0.00 8.40,c109 3.60 8.00,c107 15.80 27.90,29.21,,,,,,,,,,,,,,,,
YJ2CM,ID9V,Kitchen,5,7,Yes,a person is holding a pillow while opening the stove.,pillow,A person is holding a pillow and opening a dishwasher.,c076 0.00 24.00,22.75,,,,,,,,,,,,,,,,,,,,,,,,
3SIOT,XXN8,Recreation room / Man cave,6,6,Yes,ONe person was laughing while holding a blanket. The other was throwing around a bag,bag,blanket,clothes,A person is playing with a grocery bag. A second person is holding a blanket and laughing.,c024 0.00 6.70,c070 0.00 31.00,c149 0.00 31.00,c000 0.00 30.40,30.21,,,,,,,,,,,,,,,,,,,
WXUZK,M80J,Bedroom,7,7,Yes,Person A walks into the bedroom undressing and throwing the clothing onto a chair.  Person A them climbs onto the bed snuggling under the blanket and lying down.,bed,blanket,chair,clothes,A person is in their bedroom and undresses before getting in bed to go to sleep.,c072 17.20 24.20,c134 17.30 31.00,c155 0.00 14.70,c003 1.90 11.10,c000 1.40 8.70,c001 1.00 8.70,29.71,,,,,,,,,,,,,,,,
GXIWH,6RE8,Living room,7,7,Yes,A person is smiling at the bag and opening the coffee.,bag,chair,coffee,cup,drink,table,"a person looks at a bag on a chair then grabs a drink off a table;A person looks at a bag on a chair, pours coffee into a cup and drinks it.",c106 27.50 35.00,c107 9.70 35.00,c110 7.50 16.10,c152 0.00 13.20,c108 14.50 31.80,c009 13.00 19.10,34.42,,,,,,,,,,,,,,
H40VV,KQI6,Hallway,6,6,Yes,A person is holding the door while another person is walking with the dishes.,dish,door,"A WOMAN WALKS TO THE DOOR, SLOWLY OPENS IT AND A MAN WALKS OUT HOLDING TWO TEAPOTS ON TRAYS. THE WOMEN THEN CLOSES THE DOOR AND THEN OPENS THE DOOR AND EXITS OUT AND REUNITES WITH THE MANAC",c118 5.60 16.90,c008 1.40 11.70,c006 18.90 24.70,c120 7.10 12.40,30.92,,,,,,,,,,,,,,,,,,,,
